{
  "created_at": "2026-09-17T14:31:00.000Z",
  "declared_operator": {
    "role": "RESEARCHER",
    "subject_id": "operator.unicode.é"
  },
  "execution_constraints": {
    "requested_allow_downloads": false,
    "timeout_seconds": 3600
  },
  "expires_at": "2026-09-17T14:41:00.000Z",
  "intent_digest": "sha256:c570b2035916b460ade218194cd282c111e078a083b6eaae5780126c54dd725b",
  "intent_id": "22222222-2222-4222-8222-222222222222",
  "operation": "EVALUATE_CHECKPOINT",
  "operation_payload": {
    "checkpoint_coordinates": [
      -2147483648,
      0,
      2147483647
    ]
  },
  "schema_version": "1.0.0",
  "workload": {
    "catalog_backend_ref": "670b58f6458fe84620f4f9f46401f855d04ae05d",
    "dataset_id": "synthetic-10gene-cohort-v1",
    "model_plugin_id": "tabular-10gene-phenotype-v1",
    "requested_scope": "MODEL_DATASET_BINDING_ONLY"
  }
}
